[
  {
    "schema_version": "coa-normalized-v1",
    "class_id": 12,
    "class_name": "Barbarian",
    "tabs": [
      {
        "tab_id": 87,
        "tab_name": "Class",
        "sort_order": 0,
        "nominal_essence_kind": "ability"
      },
      {
        "tab_id": 31,
        "tab_name": "Brutality",
        "sort_order": 1,
        "nominal_essence_kind": "talent"
      },
      {
        "tab_id": 32,
        "tab_name": "Headhunting",
        "sort_order": 2,
        "nominal_essence_kind": "talent"
      },
      {
        "tab_id": 33,
        "tab_name": "Ancestry",
        "sort_order": 3,
        "nominal_essence_kind": "talent"
      }
    ],
    "essence_caps": {
      "maxTalentEssence": 25,
      "maxAbilityEssence": 26
    }
  },
  {
    "schema_version": "coa-normalized-v1",
    "class_id": 13,
    "class_name": "Witch Doctor",
    "tabs": [
      {
        "tab_id": 87,
        "tab_name": "Class",
        "sort_order": 0,
        "nominal_essence_kind": "ability"
      },
      {
        "tab_id": 34,
        "tab_name": "Voodoo",
        "sort_order": 1,
        "nominal_essence_kind": "talent"
      },
      {
        "tab_id": 35,
        "tab_name": "Brewing",
        "sort_order": 2,
        "nominal_essence_kind": "talent"
      },
      {
        "tab_id": 36,
        "tab_name": "Shadowhunting",
        "sort_order": 3,
        "nominal_essence_kind": "talent"
      }
    ],
    "essence_caps": {
      "maxTalentEssence": 25,
      "maxAbilityEssence": 26
    }
  },
  {
    "schema_version": "coa-normalized-v1",
    "class_id": 14,
    "class_name": "Felsworn",
    "tabs": [
      {
        "tab_id": 87,
        "tab_name": "Class",
        "sort_order": 0,
        "nominal_essence_kind": "ability"
      },
      {
        "tab_id": 37,
        "tab_name": "Slayer",
        "sort_order": 1,
        "nominal_essence_kind": "talent"
      },
      {
        "tab_id": 38,
        "tab_name": "Infernal",
        "sort_order": 2,
        "nominal_essence_kind": "talent"
      },
      {
        "tab_id": 18,
        "tab_name": "Tyrant",
        "sort_order": 3,
        "nominal_essence_kind": "talent"
      }
    ],
    "essence_caps": {
      "maxTalentEssence": 25,
      "maxAbilityEssence": 26
    }
  },
  {
    "schema_version": "coa-normalized-v1",
    "class_id": 15,
    "class_name": "Witch Hunter",
    "tabs": [
      {
        "tab_id": 87,
        "tab_name": "Class",
        "sort_order": 0,
        "nominal_essence_kind": "ability"
      },
      {
        "tab_id": 1,
        "tab_name": "None",
        "sort_order": 0,
        "nominal_essence_kind": "talent"
      },
      {
        "tab_id": 39,
        "tab_name": "Boltslinger",
        "sort_order": 1,
        "nominal_essence_kind": "talent"
      },
      {
        "tab_id": 94,
        "tab_name": "Black Knight",
        "sort_order": 2,
        "nominal_essence_kind": "talent"
      },
      {
        "tab_id": 40,
        "tab_name": "Houndmaster",
        "sort_order": 2,
        "nominal_essence_kind": "talent"
      },
      {
        "tab_id": 41,
        "tab_name": "Inquisition",
        "sort_order": 3,
        "nominal_essence_kind": "talent"
      }
    ],
    "essence_caps": {
      "maxTalentEssence": 25,
      "maxAbilityEssence": 26
    }
  },
  {
    "schema_version": "coa-normalized-v1",
    "class_id": 16,
    "class_name": "Stormbringer",
    "tabs": [
      {
        "tab_id": 87,
        "tab_name": "Class",
        "sort_order": 0,
        "nominal_essence_kind": "ability"
      },
      {
        "tab_id": 42,
        "tab_name": "Lightning",
        "sort_order": 1,
        "nominal_essence_kind": "talent"
      },
      {
        "tab_id": 43,
        "tab_name": "Wind",
        "sort_order": 2,
        "nominal_essence_kind": "talent"
      },
      {
        "tab_id": 44,
        "tab_name": "Maelstrom",
        "sort_order": 3,
        "nominal_essence_kind": "talent"
      }
    ],
    "essence_caps": {
      "maxTalentEssence": 25,
      "maxAbilityEssence": 26
    }
  },
  {
    "schema_version": "coa-normalized-v1",
    "class_id": 17,
    "class_name": "Knight of Xoroth",
    "tabs": [
      {
        "tab_id": 87,
        "tab_name": "Class",
        "sort_order": 0,
        "nominal_essence_kind": "ability"
      },
      {
        "tab_id": 47,
        "tab_name": "Defiance",
        "sort_order": 0,
        "nominal_essence_kind": "talent"
      },
      {
        "tab_id": 46,
        "tab_name": "Hellfire",
        "sort_order": 0,
        "nominal_essence_kind": "talent"
      },
      {
        "tab_id": 45,
        "tab_name": "War",
        "sort_order": 0,
        "nominal_essence_kind": "talent"
      }
    ],
    "essence_caps": {
      "maxTalentEssence": 25,
      "maxAbilityEssence": 26
    }
  },
  {
    "schema_version": "coa-normalized-v1",
    "class_id": 18,
    "class_name": "Guardian",
    "tabs": [
      {
        "tab_id": 87,
        "tab_name": "Class",
        "sort_order": 0,
        "nominal_essence_kind": "ability"
      },
      {
        "tab_id": 1,
        "tab_name": "None",
        "sort_order": 0,
        "nominal_essence_kind": "talent"
      },
      {
        "tab_id": 7,
        "tab_name": "Vanguard",
        "sort_order": 1,
        "nominal_essence_kind": "talent"
      },
      {
        "tab_id": 48,
        "tab_name": "Inspiration",
        "sort_order": 2,
        "nominal_essence_kind": "talent"
      },
      {
        "tab_id": 49,
        "tab_name": "Gladiator",
        "sort_order": 3,
        "nominal_essence_kind": "talent"
      }
    ],
    "essence_caps": {
      "maxTalentEssence": 25,
      "maxAbilityEssence": 26
    }
  },
  {
    "schema_version": "coa-normalized-v1",
    "class_id": 19,
    "class_name": "Templar",
    "tabs": [
      {
        "tab_id": 87,
        "tab_name": "Class",
        "sort_order": 0,
        "nominal_essence_kind": "ability"
      },
      {
        "tab_id": 50,
        "tab_name": "Zealot",
        "sort_order": 1,
        "nominal_essence_kind": "talent"
      },
      {
        "tab_id": 16,
        "tab_name": "Oathkeeper",
        "sort_order": 2,
        "nominal_essence_kind": "talent"
      },
      {
        "tab_id": 51,
        "tab_name": "Crusader",
        "sort_order": 3,
        "nominal_essence_kind": "talent"
      }
    ],
    "essence_caps": {
      "maxTalentEssence": 25,
      "maxAbilityEssence": 26
    }
  },
  {
    "schema_version": "coa-normalized-v1",
    "class_id": 20,
    "class_name": "Bloodmage",
    "tabs": [
      {
        "tab_id": 87,
        "tab_name": "Class",
        "sort_order": 0,
        "nominal_essence_kind": "ability"
      },
      {
        "tab_id": 26,
        "tab_name": "Sanguine",
        "sort_order": 1,
        "nominal_essence_kind": "talent"
      },
      {
        "tab_id": 52,
        "tab_name": "Accursed",
        "sort_order": 2,
        "nominal_essence_kind": "talent"
      },
      {
        "tab_id": 53,
        "tab_name": "Eternal",
        "sort_order": 3,
        "nominal_essence_kind": "talent"
      },
      {
        "tab_id": 93,
        "tab_name": "Fleshweaver",
        "sort_order": 3,
        "nominal_essence_kind": "talent"
      }
    ],
    "essence_caps": {
      "maxTalentEssence": 25,
      "maxAbilityEssence": 26
    }
  },
  {
    "schema_version": "coa-normalized-v1",
    "class_id": 21,
    "class_name": "Ranger",
    "tabs": [
      {
        "tab_id": 87,
        "tab_name": "Class",
        "sort_order": 0,
        "nominal_essence_kind": "ability"
      },
      {
        "tab_id": 54,
        "tab_name": "Archery",
        "sort_order": 1,
        "nominal_essence_kind": "talent"
      },
      {
        "tab_id": 55,
        "tab_name": "Brigand",
        "sort_order": 2,
        "nominal_essence_kind": "talent"
      },
      {
        "tab_id": 2,
        "tab_name": "Farstrider",
        "sort_order": 3,
        "nominal_essence_kind": "talent"
      }
    ],
    "essence_caps": {
      "maxTalentEssence": 25,
      "maxAbilityEssence": 26
    }
  },
  {
    "schema_version": "coa-normalized-v1",
    "class_id": 22,
    "class_name": "Chronomancer",
    "tabs": [
      {
        "tab_id": 71,
        "tab_name": "Blessings",
        "sort_order": 0,
        "nominal_essence_kind": "talent"
      },
      {
        "tab_id": 87,
        "tab_name": "Class",
        "sort_order": 0,
        "nominal_essence_kind": "ability"
      },
      {
        "tab_id": 56,
        "tab_name": "Infinite",
        "sort_order": 1,
        "nominal_essence_kind": "talent"
      },
      {
        "tab_id": 58,
        "tab_name": "Time",
        "sort_order": 2,
        "nominal_essence_kind": "talent"
      },
      {
        "tab_id": 57,
        "tab_name": "Artificer",
        "sort_order": 3,
        "nominal_essence_kind": "talent"
      }
    ],
    "essence_caps": {
      "maxTalentEssence": 25,
      "maxAbilityEssence": 26
    }
  },
  {
    "schema_version": "coa-normalized-v1",
    "class_id": 23,
    "class_name": "Necromancer",
    "tabs": [
      {
        "tab_id": 87,
        "tab_name": "Class",
        "sort_order": 0,
        "nominal_essence_kind": "ability"
      },
      {
        "tab_id": 59,
        "tab_name": "Death",
        "sort_order": 1,
        "nominal_essence_kind": "talent"
      },
      {
        "tab_id": 60,
        "tab_name": "Rime",
        "sort_order": 2,
        "nominal_essence_kind": "talent"
      },
      {
        "tab_id": 61,
        "tab_name": "Animation",
        "sort_order": 3,
        "nominal_essence_kind": "talent"
      }
    ],
    "essence_caps": {
      "maxTalentEssence": 25,
      "maxAbilityEssence": 26
    }
  },
  {
    "schema_version": "coa-normalized-v1",
    "class_id": 24,
    "class_name": "Pyromancer",
    "tabs": [
      {
        "tab_id": 87,
        "tab_name": "Class",
        "sort_order": 0,